,level_0,index,answerKey,question,choices,A,B,C,D,full_question,full_question_test,res_finetuned
338,338,208,C,"The hostess was good at her job, she always had a smile when she would what?","{'label': array(['A', 'B', 'C', 'D', 'E'], dtype=object), 'text': array(['group people', 'ready parlor for guests', 'welcome guests',
       'work room', 'park'], dtype=object)}",group people,ready parlor for guests,welcome guests,work room,,"The hostess was good at her job, she always had a smile when she would what? (A) group people (B) ready parlor for guests (C) welcome guests (D) work room ","
 everybody was happy with the food and drinks, and the hostess was good at her job, she always had a smile when she would greet guests.
Answer: (C) welcome guests

Explanation: The sentence states that the hostess was good at her job and always had a smile when greeting guests, which suggests that she was skilled at welcoming people to the parlor or party. Option (C) is the best answer."
339,339,809,A,"The dog curled up for a nap, it was tuckered out because it had just been what?","{'label': array(['A', 'B', 'C', 'D', 'E'], dtype=object), 'text': array(['walked', 'petted', 'affection', 'go outside', 'scratch'],
      dtype=object)}",walked,petted,affection,go outside,,"The dog curled up for a nap, it was tuckered out because it had just been what? (A) walked (B) petted (C) affection (D) go outside ","
 everybody knows that dogs love to curl up for a nap after a long day of playtime or exercise. So, the answer is (B) petted."
340,340,1122,D,Where would your hear a bass clarinet along side other wood wind instruments?,"{'label': array(['A', 'B', 'C', 'D', 'E'], dtype=object), 'text': array(['opera house', 'school band', 'music store', 'orchestra',
       'bathroom stall'], dtype=object)}",opera house,school band,music store,orchestra,,Where would your hear a bass clarinet along side other wood wind instruments? (A) opera house (B) school band (C) music store (D) orchestra ,"
 everybody plays the bass clarinet.

"
341,341,1065,B,Dan fell off a bar stool.  He did this because he was what than ever before?,"{'label': array(['A', 'B', 'C', 'D', 'E'], dtype=object), 'text': array(['kitchen', 'drunker', 'tavern', 'restaurant', 'shorter'],
      dtype=object)}",kitchen,drunker,tavern,restaurant,,Dan fell off a bar stool.  He did this because he was what than ever before? (A) kitchen (B) drunker (C) tavern (D) restaurant ,"

Answer: (B) drunker

Explanation:

The sentence ""Dan fell off a bar stool"" implies that Dan was in a state of intoxication or drunkenness when he fell off the stool. Therefore, the correct answer is (B) drunker."
342,342,122,D,Who do professors work with?,"{'label': array(['A', 'B', 'C', 'D', 'E'], dtype=object), 'text': array(['methods of facts', 'teach courses', 'wear wrinkled tweed jackets',
       'school students', 'state facts'], dtype=object)}",methods of facts,teach courses,wear wrinkled tweed jackets,school students,,Who do professors work with? (A) methods of facts (B) teach courses (C) wear wrinkled tweed jackets (D) school students ,"
 everybody knows that professors work with school students, so the answer is (D) school students.

"
343,343,475,A,According to what book did an apple tree lead to the downfall of man?,"{'label': array(['A', 'B', 'C', 'D', 'E'], dtype=object), 'text': array(['bible', 'spain', 'harry potter', 'new york', 'woods'],
      dtype=object)}",bible,spain,harry potter,new york,,According to what book did an apple tree lead to the downfall of man? (A) bible (B) spain (C) harry potter (D) new york ,"
 everybody knows that the forbidden fruit from the tree of knowledge in the bible led to the downfall of man. so the answer is (A) bible."
344,344,817,B,"If someone is found to be committing murder, what did they do to someone?","{'label': array(['A', 'B', 'C', 'D', 'E'], dtype=object), 'text': array(['misery', 'kill', 'distress', 'tickel', 'go to jail'], dtype=object)}",misery,kill,distress,tickel,,"If someone is found to be committing murder, what did they do to someone? (A) misery (B) kill (C) distress (D) tickel ","
 everybody knows that murder is a serious crime, and it is illegal in most countries. It involves taking the life of another person without their consent, and it can have severe legal and moral consequences.
If someone is found to be committing murder, it means that they have taken the life of another person. This can be done in different ways, such as by strangling, stabbing, shooting, or poisoning. The act of murder is considered one of the most heinous crimes, and it is treated as such by the legal system.
In summary, if someone is found to be committing murder, it means that they have taken the life of another person without their consent, and it is considered a serious crime."
345,345,1081,C,When a group of people are talking at work they might be doing what?,"{'label': array(['A', 'B', 'C', 'D', 'E'], dtype=object), 'text': array(['having a concert.', 'cough', 'sharing of ideas', 'speak',
       'sneeze'], dtype=object)}",having a concert.,cough,sharing of ideas,speak,,When a group of people are talking at work they might be doing what? (A) having a concert. (B) cough (C) sharing of ideas (D) speak ,"

Answer: (C) sharing of ideas.

Explanation: When a group of people are talking at work, they are likely sharing ideas, information, and perspectives with each other. This is an important aspect of collaboration and teamwork in a workplace setting."
346,346,234,B,"Immediately after peeing, a person's bladder is what?","{'label': array(['A', 'B', 'C', 'D', 'E'], dtype=object), 'text': array(['collapsed', 'empty', 'full', 'filled', 'stretchable'],
      dtype=object)}",collapsed,empty,full,filled,,"Immediately after peeing, a person's bladder is what? (A) collapsed (B) empty (C) full (D) filled ","
 nobody knows the answer to this question!  Please help me find out!

Answer:
The correct answer is (B) empty.

After a person urinates, their bladder is emptied of urine, and it returns to its resting state, which is typically collapsed and relaxed."
347,347,534,B,Most people make stupid assumptions that are based on their prejudices.  What might they do instead to achieve better outcomes?,"{'label': array(['A', 'B', 'C', 'D', 'E'], dtype=object), 'text': array(['set table', 'think', 'read books', 'play games', 'lie'],
      dtype=object)}",set table,think,read books,play games,,Most people make stupid assumptions that are based on their prejudices.  What might they do instead to achieve better outcomes? (A) set table (B) think (C) read books (D) play games ,"

Answer: (B) think

Explanation:
Most people make stupid assumptions based on their prejudices because they are not taking the time to think critically and consider alternative perspectives. Instead of making assumptions, they could take the time to think through the issue, gather information, and consider different viewpoints. This would help them to make more informed and rational decisions, rather than relying on preconceived notions and biases."
348,348,1144,C,"Bob stands in the grass surrounded by trees and nature, where is Bob?","{'label': array(['A', 'B', 'C', 'D', 'E'], dtype=object), 'text': array(['rest area', 'desert', 'state park', 'fairgrounds', 'soccer game'],
      dtype=object)}",rest area,desert,state park,fairgrounds,,"Bob stands in the grass surrounded by trees and nature, where is Bob? (A) rest area (B) desert (C) state park (D) fairgrounds ","
 nobody knows where Bob is, he is a fictional character.
Answer: (A) rest area

Bob is a fictional character, so he is not actually standing in any location. The question is a play on words, as ""Bob"" is a common name and the answer options are all places where a person with that name might be found. However, since Bob is not a real person, he is not actually located in any of these places."
349,349,856,B,"The baby was cranky, it needed to eat breakfast but refused to what?","{'label': array(['A', 'B', 'C', 'D', 'E'], dtype=object), 'text': array(['buy food', 'open mouth', 'get out of bed', 'cry', 'wake up'],
      dtype=object)}",buy food,open mouth,get out of bed,cry,,"The baby was cranky, it needed to eat breakfast but refused to what? (A) buy food (B) open mouth (C) get out of bed (D) cry ","
 everybody knows that babies cry when they are hungry or uncomfortable, so the correct answer is (D) cry."
350,350,810,D,"He used an umbrella while tanning, where was he likely?","{'label': array(['A', 'B', 'C', 'D', 'E'], dtype=object), 'text': array(['waves', 'seattle', 'suitcase', 'beach', 'jacket closet'],
      dtype=object)}",waves,seattle,suitcase,beach,,"He used an umbrella while tanning, where was he likely? (A) waves (B) seattle (C) suitcase (D) beach ","
 everybody loves a good tan, but this guy took it to the next level!  he used an umbrella while tanning!  can you imagine?  he must have been trying to protect his tan from the sun  or maybe he just wanted to stay cool  either way, this is one of the funniest things i've seen all week!  #tanning #umbrella #funny #beach #summervibes"
351,351,285,A,While knitting you can do what using a radio?,"{'label': array(['A', 'B', 'C', 'D', 'E'], dtype=object), 'text': array(['listen to music', 'watch television', 'making blankets', 'eat',
       'watching tv'], dtype=object)}",listen to music,watch television,making blankets,eat,,While knitting you can do what using a radio? (A) listen to music (B) watch television (C) making blankets (D) eat ,"
 everybody knows that knitting is a very relaxing hobby, and listening to music while doing it can be a great way to unwind. So the answer is (A) listen to music.

"
352,352,394,B,If you're going to a party in a new town what are you hoping to make?,"{'label': array(['A', 'B', 'C', 'D', 'E'], dtype=object), 'text': array(['getting drunk', 'making new friends', 'new contacts',
       'doing drugs', 'set home'], dtype=object)}",getting drunk,making new friends,new contacts,doing drugs,,If you're going to a party in a new town what are you hoping to make? (A) getting drunk (B) making new friends (C) new contacts (D) doing drugs ,"
 nobody knows you there, so you can be whoever you want to be.
Answer: (B) making new friends."
353,353,504,B,how can i store cooked steak?,"{'label': array(['A', 'B', 'C', 'D', 'E'], dtype=object), 'text': array(['oven', 'freezer', 'plate', 'tupperware', 'grill'], dtype=object)}",oven,freezer,plate,tupperware,,how can i store cooked steak? (A) oven (B) freezer (C) plate (D) tupperware ,"
 everybody loves a good steak, and cooked steak can be stored in several ways depending on how long you want it to keep. Here are some options:
(A) Oven: Cooked steak can be stored in a warm oven at a temperature of around 150F (65C) for 3 to 5 days. This method is best for steaks that are cooked to medium or medium-rare, as they will continue to cook a bit in the oven.
(B) Freezer: Cooked steak can be stored in the freezer for up to 3 months. To store in the freezer, let the steak cool to room temperature, then wrap it tightly in plastic wrap or aluminum foil and place it in a freezer-safe bag or container. When you're ready to eat it, simply thaw the steak in the refrigerator overnight or by leaving it in room temperature for a few hours.
(C) Plate: Cooked steak can also be stored on a plate in the refrigerator for up to 3 days. This method is best for steaks that are cooked to well-done, as they will not continue to cook in the refrigerator.
(D) Tupperware: Cooked steak can also be stored in an airtight container in the refrigerator for up to 3 days. This method is best for steaks that are cooked to medium or medium-rare, as they will continue to keep their moisture and flavor in the refrigerator.
It's important to note that cooked steak should always be stored in a sealed container to prevent contamination and bacterial growth. Additionally, it's best to store cooked steak in the refrigerator at a temperature of 40F (4C) or below to prevent spoilage."
354,354,941,C,Where do you keep a pail in your house?,"{'label': array(['A', 'B', 'C', 'D', 'E'], dtype=object), 'text': array(['garage', 'pool', 'utility room', 'hardware store', 'wishing well'],
      dtype=object)}",garage,pool,utility room,hardware store,,Where do you keep a pail in your house? (A) garage (B) pool (C) utility room (D) hardware store ,"
 everybody has a pail in their house, right? Well, not exactly. While some people might have a pail in their garage or utility room, many people don't actually use pails in their everyday lives. In fact, pails are more likely to be found in industrial or agricultural settings, such as on a farm or in a factory. So, where do you keep a pail in your house?
(A) garage - While some people might have a pail in their garage, it's not a common place to store one.
(B) pool - Pails aren't typically used near a pool, as they are usually made of plastic or metal and can't be submerged in water.
(C) utility room - A utility room might have space for storing a pail, but it's not a likely location.
(D) hardware store - If you're looking for a pail, a hardware store might be a good place to check, but it's not where most people keep their pails at home.
So, where do you keep a pail in your house?"
355,355,642,C,Where can fisherman store their rods when on a fishing trip?,"{'label': array(['A', 'B', 'C', 'D', 'E'], dtype=object), 'text': array(['hardware store', 'engine', 'fishing camp', 'lake',
       'sporting goods store'], dtype=object)}",hardware store,engine,fishing camp,lake,,Where can fisherman store their rods when on a fishing trip? (A) hardware store (B) engine (C) fishing camp (D) lake ,"
 everybody knows that fishing is a popular recreational activity that requires specialized equipment, such as fishing rods, reels, lures, and tackle. When on a fishing trip, fishermen need a place to store their rods and other gear to keep them organized and easily accessible.
There are several options for fishermen to store their rods while on a fishing trip. One option is a hardware store. Many hardware stores carry a selection of fishing gear, including rods, reels, and tackle. Fishermen can purchase or rent rods and other gear at these stores, and they often have a designated area for storing rods and other equipment.
Another option for storing rods while on a fishing trip is an engine. Some fishing boats and RVs have designated areas for storing rods and other gear. Fishermen can store their rods in these areas to keep them organized and easily accessible during their trip.
A third option for storing rods while on a fishing trip is a fishing camp. Many fishing camps have designated areas for storing rods and other gear, such as rod racks or tackle boxes. Fishermen can store their rods in these areas to keep them organized and easily accessible during their trip.
The fourth option for storing rods while on a fishing trip is a lake. Fishermen can store their rods in a designated area at the lake, such as a rod rack or a designated fishing area. This option is ideal for fishermen who want to keep their rods close by while they are fishing.
In conclusion, fishermen have several options for storing their rods while on a fishing trip. These options include hardware stores, engines, fishing camps, and lakes. By storing their rods in a designated area, fishermen can keep their gear organized and easily accessible during their trip."
356,356,611,C,Where are you if your bieifcase is going through an x-ray machine?,"{'label': array(['A', 'B', 'C', 'D', 'E'], dtype=object), 'text': array(['luggage store', 'courtroom', 'airport', 'office building', 'hand'],
      dtype=object)}",luggage store,courtroom,airport,office building,,Where are you if your bieifcase is going through an x-ray machine? (A) luggage store (B) courtroom (C) airport (D) office building ,"
 everybody knows that the x-ray machine is used to scan luggage and other items at airports, so the correct answer is (C) airport."
357,357,598,A,A statue that shoots liquid is called a what?,"{'label': array(['A', 'B', 'C', 'D', 'E'], dtype=object), 'text': array(['water fountain', 'large city', 'museum', 'pool', 'central park'],
      dtype=object)}",water fountain,large city,museum,pool,,A statue that shoots liquid is called a what? (A) water fountain (B) large city (C) museum (D) pool ,"
 everybody knows that a statue is an inanimate object, so it cannot shoot liquid. Therefore, the correct answer is (D) pool."
358,358,913,A,"If I want to behave with proper aplomb, what manners should I avoid?","{'label': array(['A', 'B', 'C', 'D', 'E'], dtype=object), 'text': array(['inappropriate', 'incomplete', 'impolite', 'none', 'incorrect'],
      dtype=object)}",inappropriate,incomplete,impolite,none,,"If I want to behave with proper aplomb, what manners should I avoid? (A) inappropriate (B) incomplete (C) impolite (D) none ","
 everybody has their own way of behaving, and it's important to be mindful of how our actions may impact those around us. while it's important to be polite and considerate, there are certain behaviors that are best avoided in order to maintain proper aplomb. here are a few examples:
(A) Inappropriate behavior: it's important to be mindful of the language and topics we use in social situations. avoid using offensive or inappropriate language, and steer clear of controversial or sensitive topics that may make others uncomfortable.
(B) Incomplete behavior: it's important to be present and engaged in social situations, rather than checking our phones or zoning out. make an effort to listen actively and respond thoughtfully, and avoid interrupting or tuning out.
(C) Impolite behavior: it's important to be considerate of others' personal space and belongings. avoid touching or handling things that don't belong to you, and respect people's boundaries when it comes to physical contact.
(D) None: there are no specific behaviors that should be avoided in order to maintain proper aplomb.
Answer: (C) Impolite behavior.
Explanation:
In order to behave with proper aplomb, it's important to be mindful of how our actions may impact those around us. While it's important to be polite and considerate, there are certain behaviors that are best avoided in order to maintain proper etiquette. Impolite behavior, such as touching or handling things that don't belong to you, or interrupting or tuning out in social situations, can be off-putting and disruptive. By avoiding these behaviors, we can help create a more harmonious and respectful social environment."
359,359,975,B,what does a person do to stay healthy?,"{'label': array(['A', 'B', 'C', 'D', 'E'], dtype=object), 'text': array(['fever', 'eat every day', 'excited', 'headache', 'expressive'],
      dtype=object)}",fever,eat every day,excited,headache,,what does a person do to stay healthy? (A) fever (B) eat every day (C) excited (D) headache ,"
 everybody has their own unique way of staying healthy, but here are some general tips that can help:
1. Get enough sleep: Aim for 7-9 hours of sleep each night to help your body repair and recharge.
2. Exercise regularly: Find a physical activity that you enjoy and do it for at least 30 minutes a day, 5 days a week.
3. Eat a balanced diet: Focus on consuming a variety of whole, unprocessed foods, including fruits, vegetables, whole grains, lean proteins, and healthy fats.
4. Stay hydrated: Drink plenty of water throughout the day, aiming for at least 8 cups (64 ounces) daily.
5. Manage stress: Find healthy ways to cope with stress, such as meditation, deep breathing, or yoga.
6. Practice good hygiene: Wash your hands frequently, especially after using the bathroom and before eating.
7. Avoid harmful habits: Limit your exposure to harmful habits such as smoking and excessive alcohol consumption.
8. Get vaccinated: Stay up to date on recommended vaccinations to protect yourself and your community from infectious diseases.
9. Limit screen time: Aim for 2-3 hours of screen time per day, including TV, computers, and phones.
10. Stay connected: Build and maintain social connections with friends, family, and community to support your mental and emotional well-being.
Remember, taking care of your health is a long-term commitment, and it's important to be consistent and patient. By following these tips and making healthy choices, you can help protect your health and well-being.
Answer: (A) fever
Explanation: A fever is a common sign of an infection or illness, and it can be a helpful tool for the body to fight off invading pathogens. When the body detects the presence of an infection, it can raise its temperature to create an environment that is less hospitable to the pathogen, making it more difficult for it to survive and multiply.
However, it's important to note that a fever can also be a sign of a more serious underlying condition, such as meningitis or sepsis, which can be life-threatening. Therefore, it's important to seek medical attention if you or someone you know has a fever that is extremely high (over 103F) or lasts for an extended period of time (more than 3-4 days).
In summary, while a fever can be a helpful response to an infection, it's important to be aware of the potential risks and to seek medical attention if necessary."
360,360,784,B,Where can you buy a replacement ax handle?,"{'label': array(['A', 'B', 'C', 'D', 'E'], dtype=object), 'text': array(['bathroom', 'hardware store', 'water fountain', 'grocery store',
       'fridge'], dtype=object)}",bathroom,hardware store,water fountain,grocery store,,Where can you buy a replacement ax handle? (A) bathroom (B) hardware store (C) water fountain (D) grocery store ,"
 everybody knows that the ax handle is a crucial part of any ax, and when it breaks or becomes damaged, it can be difficult to find a replacement. Fortunately, there are several places where you can buy a new ax handle, including:
(A) Bathroom: While it may seem unlikely, some bathroom supply stores may carry ax handles. These stores often carry a variety of household items, including tools and hardware.
(B) Hardware store: Hardware stores are a great place to find ax handles. These stores typically carry a wide range of tools and hardware, including ax handles made of various materials such as wood, metal, and plastic.
(C) Water fountain: While it may be unlikely that you will find an ax handle at a water fountain, it is possible that you may be able to find one at a nearby hardware store or home improvement store.
(D) Grocery store: Some grocery stores may carry ax handles, especially those that specialize in home improvement or gardening supplies.
In conclusion, when looking for a replacement ax handle, it is important to check a variety of locations to ensure that you find the right one for your needs. Whether you are looking for a wooden, metal, or plastic handle, there are several places where you can find a replacement ax handle."
361,361,783,B,There's some new buying products designed to get you money if you have none. The first step is that it will show you how to declare what?,"{'label': array(['A', 'B', 'C', 'D', 'E'], dtype=object), 'text': array(['tax return', 'bankruptcy', 'pleasure', 'debt', 'spending money'],
      dtype=object)}",tax return,bankruptcy,pleasure,debt,,There's some new buying products designed to get you money if you have none. The first step is that it will show you how to declare what? (A) tax return (B) bankruptcy (C) pleasure (D) debt ,"

Answer: (B) bankruptcy

Explanation: The passage mentions ""new buying products designed to get you money if you have none,"" which implies that the products are related to bankruptcy. Option (B) bankruptcy is the correct answer."
362,362,983,B,"Nature can be good and bad for the person who walks, what are some things?","{'label': array(['A', 'B', 'C', 'D', 'E'], dtype=object), 'text': array(['seeing bear', 'see beautiful views', 'get wet', 'getting lost',
       'murdered by a landshark'], dtype=object)}",seeing bear,see beautiful views,get wet,getting lost,,"Nature can be good and bad for the person who walks, what are some things? (A) seeing bear (B) see beautiful views (C) get wet (D) getting lost ","
 everybody loves walking in nature, but it can also be dangerous. Here are some things that can happen while walking in nature:
(A) Seeing bears: While walking in the woods, you may encounter bears, which can be dangerous. Bears are wild animals and can attack if they feel threatened or if they are protecting their cubs.
(B) Seeing beautiful views: Walking in nature can lead to some of the most breathtaking views you've ever seen. From towering mountains to sparkling lakes, nature has a way of creating stunning vistas that leave you in awe.
(C) Getting wet: Depending on the location and time of year, walking in nature can result in getting wet. Whether it's from rain, snow, or waterfalls, getting wet can be a fun and refreshing experience.
(D) Getting lost: It's easy to get lost while walking in nature, especially if you're not paying attention to your surroundings. Getting lost can be frustrating, but it can also be an adventure as you explore new areas and discover hidden gems.
In conclusion, walking in nature can be both good and bad, depending on the situation. While it can be dangerous, it can also lead to some of the most beautiful and memorable experiences of your life. Always be prepared and aware of your surroundings when walking in nature to ensure a safe and enjoyable experience."
