,level_0,index,answerKey,question,choices,A,B,C,D,full_question,full_question_test,res_finetuned
242,242,1215,B,"If you really wanted a grape, where would you go to get it?","{'label': array(['A', 'B', 'C', 'D', 'E'], dtype=object), 'text': array(['winery', 'fruit stand', 'field', 'kitchen', 'food'], dtype=object)}",winery,fruit stand,field,kitchen,,"If you really wanted a grape, where would you go to get it? (A) winery (B) fruit stand (C) field (D) kitchen ","
 everybody loves grapes! They are sweet, juicy, and packed with nutrients. But where do you go to get your hands on some fresh grapes? Well, the answer depends on where you are in the world. Here are some options:
(A) Winery: If you're in a region known for its wine production, you might be able to find grapes at a local winery. Many wineries have vineyards where they grow their own grapes, and they may offer tastings or tours where you can pick your own. Just be sure to check the hours and availability before you go!
(B) Fruit stand: Many farmers' markets or roadside fruit stands will carry fresh grapes, especially during the peak harvest season. These stands often source their produce from local farms, so you may be able to find grapes that are grown right in your area.
(C) Field: If you're near a vineyard or orchard, you might be able to find grapes growing in the field. Many farms offer pick-your-own options, where you can pay a fee to pick your own fruits and vegetables. Just be sure to follow any rules or guidelines provided by the farm to ensure you're picking safely and responsibly.
(D) Kitchen: If you don't have access to fresh grapes, you can always try growing your own at home! Grapes are relatively easy to grow indoors or outdoors, and you can find plenty of resources online to help you get started. Just be sure to provide the right conditions for your grapes to thrive.
So there you have it  four options for getting your hands on some fresh grapes! No matter where you go, be sure to enjoy them responsibly and in moderation."
243,243,142,B,"Sam was a stranger.  Even so, Mark treated him like what?","{'label': array(['A', 'B', 'C', 'D', 'E'], dtype=object), 'text': array(['friend', 'family', 'known person', 'park', 'outsider'],
      dtype=object)}",friend,family,known person,park,,"Sam was a stranger.  Even so, Mark treated him like what? (A) friend (B) family (C) known person (D) park "," ranger
Mark treated Sam like a friend."
244,244,305,D,What do you write letter in in America?,"{'label': array(['A', 'B', 'C', 'D', 'E'], dtype=object), 'text': array(['syllable', 'post office', 'envelope', 'english alphabet', 'word'],
      dtype=object)}",syllable,post office,envelope,english alphabet,,What do you write letter in in America? (A) syllable (B) post office (C) envelope (D) english alphabet ,"
 everybody writes letters in America, right? Wrong! While letter writing is still a common practice in the United States, the use of letters has declined significantly in recent years due to the rise of digital communication.
In fact, a 2019 survey by the Pew Research Center found that only 35% of American adults reported writing letters in the past year, with the majority of those letters being written to family members or close friends. This is a significant decrease from the 60% of adults who reported writing letters in 1990.
So, what do people in America write letters for? The most common reasons include:
1. Personal correspondence: Letters are still a popular way to stay in touch with friends and family who live far away or who you don't see often in person.
2. Business communication: Letters are often used in a professional setting to communicate with clients, colleagues, or other businesses.
3. Expressing emotions: Letters can be a meaningful way to express emotions or feelings that are difficult to convey in other forms of communication.
4. Documenting events: Letters can be used to document important events or milestones in a person's life, such as a wedding or a graduation.
So, while letter writing may not be as popular as it once was, it is still a common practice in America and serves many important purposes."
245,245,69,D,What continent has the most castles?,"{'label': array(['A', 'B', 'C', 'D', 'E'], dtype=object), 'text': array(['fairy tale', 'edinburgh', 'germany', 'europe', 'antarctica'],
      dtype=object)}",fairy tale,edinburgh,germany,europe,,What continent has the most castles? (A) fairy tale (B) edinburgh (C) germany (D) europe ,"
 everybody knows that the answer is (D) Europe. Europe has the most castles in the world, with over 20,000 castles scattered across the continent. From the medieval castles of England and Wales to the fairytale castles of Germany and France, Europe is home to some of the most impressive and historic castles in the world. So, if you're looking to explore some of the most beautiful and iconic castles in the world, Europe is the place to be!"
246,246,357,B,"A man takes a seat at a museum outside of Barcelona, where is he likely?","{'label': array(['A', 'B', 'C', 'D', 'E'], dtype=object), 'text': array(['in cinema', 'martorell', 'falling down', 'show', 'airplane'],
      dtype=object)}",in cinema,martorell,falling down,show,,"A man takes a seat at a museum outside of Barcelona, where is he likely? (A) in cinema (B) martorell (C) falling down (D) show ","
 everybody has a story to tell, and this man is no exception. He sits on a bench outside of the museum, staring off into the distance with a look of deep contemplation on his face. His eyes are sunken and his clothes are worn and tattered, but there is a sense of peace about him. He has been through a lot in his life, and yet he still finds joy in the simple things. As he sits there, he remembers the past, the people he has loved and lost, and the experiences that have shaped him into the person he is today. He is a man of few words, but his eyes tell a story of their own."
247,247,887,C,If you're a child answering questions and an adult is asking them that adult is doing what?,"{'label': array(['A', 'B', 'C', 'D', 'E'], dtype=object), 'text': array(['discussion', 'explaning', 'teaching', 'confusion', 'correct'],
      dtype=object)}",discussion,explaning,teaching,confusion,,If you're a child answering questions and an adult is asking them that adult is doing what? (A) discussion (B) explaning (C) teaching (D) confusion ,"
 everybody knows that the correct answer is (C) teaching."
248,248,571,D,What is someone likely to want as a result of sex?,"{'label': array(['A', 'B', 'C', 'D', 'E'], dtype=object), 'text': array(['sexploiter', 'chicken', 'reproductive cycle', 'procreation',
       'human experience'], dtype=object)}",sexploiter,chicken,reproductive cycle,procreation,,What is someone likely to want as a result of sex? (A) sexploiter (B) chicken (C) reproductive cycle (D) procreation ,"
 everybody wants to have sex with someone they love and care about.
Answer: (D) procreation.
Explanation: Sex is a fundamental human need and desire, and one of the most common reasons why people want to have sex is to reproduce and create new life. This is especially true for heterosexual couples, who may want to have children as a way to deepen their emotional bond and create a family together. Additionally, many people may want to have sex as a way to express their love and affection for their partner, or simply as a way to feel close and connected to them. While other options may be possible, procreation is the most common reason why people want to have sex."
249,249,934,D,What could happen to you after you are cleaning house for a long time?,"{'label': array(['A', 'B', 'C', 'D', 'E'], dtype=object), 'text': array(['neatness', 'tiredness', 'order', 'exhaustion', 'sneezing'],
      dtype=object)}",neatness,tiredness,order,exhaustion,,What could happen to you after you are cleaning house for a long time? (A) neatness (B) tiredness (C) order (D) exhaustion ,"
 everybody knows that cleaning the house is a chore that needs to be done regularly. But what happens when you spend too much time cleaning? Here are some potential consequences of cleaning for too long: (A) Neatness: When you spend too much time cleaning, you may become too focused on keeping things neat and tidy. This can lead to an obsession with cleanliness, where every surface is spotless and every item is in its place. While it's important to maintain a clean and organized home, an excessive focus on neatness can lead to a lack of creativity and spontaneity. (B) Tiredness: Cleaning can be physically and mentally exhausting, especially when done for extended periods of time. Prolonged cleaning sessions can lead to fatigue, muscle strain, and mental burnout. It's important to take breaks and give yourself time to rest and recharge. (C) Order: Cleaning can help create a sense of order in your home, but too much cleaning can lead to an unhealthy obsession with orderliness. When everything is perfectly organized and in its place, it can become difficult to relax and enjoy your space. It's important to strike a balance between cleanliness and disorder, allowing for a comfortable and functional living environment. (D) Exhaustion: Cleaning for too long can lead to physical and mental exhaustion. When you spend too much time on cleaning, you may neglect other important aspects of your life, such as work, socializing, and self-care. It's important to set boundaries and prioritize self-care to avoid burnout. In conclusion, cleaning is an important part of maintaining a clean and organized home, but it's important to strike a balance between cleanliness and other aspects of life. Prolonged cleaning sessions can lead to negative consequences such as neatness, tiredness, order, and exhaustion. It's important to take breaks, prioritize self-care, and maintain a healthy balance between cleanliness and other aspects of life."
250,250,859,C,Where would you get a pen if you do not have one?,"{'label': array(['A', 'B', 'C', 'D', 'E'], dtype=object), 'text': array(['briefcase', 'desk drawer', ""friend's house"", 'pocket', 'sidewalk'],
      dtype=object)}",briefcase,desk drawer,friend's house,pocket,,Where would you get a pen if you do not have one? (A) briefcase (B) desk drawer (C) friend's house (D) pocket ,"
 everybody has a pen in their pocket.

Answer: (D) pocket."
251,251,424,C,In a horror movie victims usually trip when the run in order to do what in regards to the killer?,"{'label': array(['A', 'B', 'C', 'D', 'E'], dtype=object), 'text': array(['frightened', 'run up stairs', 'get away from', 'go quickly',
       'go faster'], dtype=object)}",frightened,run up stairs,get away from,go quickly,,In a horror movie victims usually trip when the run in order to do what in regards to the killer? (A) frightened (B) run up stairs (C) get away from (D) go quickly ,"
 everybody knows that when you are being chased by a killer, the last thing you want to do is trip and fall. So, the answer is (C) get away from."
252,252,275,A,What has a surface with many sides?,"{'label': array(['A', 'B', 'C', 'D', 'E'], dtype=object), 'text': array(['tetrahedron', 'object', 'geometry problem', 'lake', 'triangle'],
      dtype=object)}",tetrahedron,object,geometry problem,lake,,What has a surface with many sides? (A) tetrahedron (B) object (C) geometry problem (D) lake ,"
 everybody knows the answer is (A) tetrahedron. But did you know that the question is actually a trick question? The surface of a tetrahedron has only 4 sides, not many! So the correct answer is actually (B) object."
253,253,472,B,Kissing is normally an activity reserved for your romantic what?,"{'label': array(['A', 'B', 'C', 'D', 'E'], dtype=object), 'text': array(['anus', 'partner', 'arousal', 'trust', 'cooperation'], dtype=object)}",anus,partner,arousal,trust,,Kissing is normally an activity reserved for your romantic what? (A) anus (B) partner (C) arousal (D) trust ,"
 everybody has their own unique way of kissing, but there are some common factors that can make or break a kiss. Here are some of the most important things to consider:
1. Attention to detail: Paying attention to the small details of a kiss can make a big difference in how enjoyable it is. This includes things like the pressure of the lips, the angle of the mouth, and the amount of tongue involved.
2. Communication: Communication is key in any romantic encounter, and kissing is no exception. Make sure you and your partner are on the same page and that you're both comfortable with what's happening.
3. Consent: Consent is crucial in any sexual encounter, and kissing is no exception. Make sure you have your partner's consent before engaging in any kind of kissing.
4. Comfort: Being comfortable with your partner and the situation is essential for a good kiss. If you're feeling uncomfortable or self-conscious, it can be difficult to fully enjoy the experience.
5. Chemistry: Chemistry is an important factor in any romantic encounter, and kissing is no exception. If you and your partner don't have any chemistry, it can be difficult to make the kiss work.
6. Timing: Timing is everything when it comes to kissing. Make sure you're both on the same page and that the kiss is timed correctly.
7. Location: The location of the kiss can also make a big difference. Consider the setting and whether it's comfortable and private.
8. Preparation: Being prepared for a kiss can make a big difference in how enjoyable it is. Make sure you're both ready and comfortable with what's happening.
9. Expectations: Having clear expectations can help make a kiss more enjoyable. Make sure you and your partner are on the same page and that you're both comfortable with what's happening.
10. Trust: Trust is essential in any romantic encounter, and kissing is no exception. Make sure you trust your partner and that they're comfortable with what's happening.
In conclusion, kissing is a complex and multifaceted activity that involves a range of factors. By paying attention to these factors, you can make the most of your next kiss and enjoy a truly memorable experience."
254,254,487,D,"When you see something rise, you are where in relation to it?","{'label': array(['A', 'B', 'C', 'D', 'E'], dtype=object), 'text': array(['sun set', 'near', 'fall', 'below', 'lower'], dtype=object)}",sun set,near,fall,below,,"When you see something rise, you are where in relation to it? (A) sun set (B) near (C) fall (D) below ","
 everybody knows that the sun rises in the east and sets in the west. So, when you see the sun rise, you are facing east.
Answer: (A) sun set"
255,255,262,D,"The forest experienced a cold winter, where is it located?","{'label': array(['A', 'B', 'C', 'D', 'E'], dtype=object), 'text': array(['earth', 'south america', 'amazon basin', 'temperate zone',
       'national park'], dtype=object)}",earth,south america,amazon basin,temperate zone,,"The forest experienced a cold winter, where is it located? (A) earth (B) south america (C) amazon basin (D) temperate zone ","
 everybody knows that the forest is located in the temperate zone, but the question is tricky because it doesn't specify which temperate zone. Is it Europe, Asia, or North America?


"
256,256,873,D,Why do people who are dying receive social security payments?,"{'label': array(['A', 'B', 'C', 'D', 'E'], dtype=object), 'text': array(['rejuvenation', 'born again', 'no longer exist', 'unable to work',
       'change of color'], dtype=object)}",rejuvenation,born again,no longer exist,unable to work,,Why do people who are dying receive social security payments? (A) rejuvenation (B) born again (C) no longer exist (D) unable to work ,"
 everybody has the right to be treated with dignity and respect, regardless of their health status.
Answer: C) no longer exist.
People who are dying typically do not receive social security payments because they are no longer alive to receive them. Social security payments are typically made to individuals who are retired, disabled, or otherwise eligible for the benefits, and are intended to provide financial support to individuals who are no longer able to work. When someone dies, they are no longer eligible to receive social security payments, as they are no longer alive to receive them.
It is important to note that the Social Security Administration (SSA) has a process in place for handling the estates of deceased beneficiaries, including the distribution of any remaining social security payments to the beneficiary's estate or to other eligible recipients. However, the SSA will not make payments to individuals who have passed away."
257,257,1082,D,What emotion leads to punching?,"{'label': array(['A', 'B', 'C', 'D', 'E'], dtype=object), 'text': array(['fists', 'hitting', 'boxing gloves', 'anger', 'hands'],
      dtype=object)}",fists,hitting,boxing gloves,anger,,What emotion leads to punching? (A) fists (B) hitting (C) boxing gloves (D) anger ,"
 everybody knows that punching is a form of physical violence, and it is not a healthy or productive way to express or manage emotions. Punching can cause physical harm to oneself or others, and it can also lead to legal and social consequences. Therefore, it is important to find alternative and constructive ways to manage and express emotions, such as talking to a trusted friend or family member, engaging in physical activity, or practicing relaxation techniques like deep breathing or meditation.
Answer: (D) anger
Explanation: Punching is often a result of feeling angry or frustrated, and it can be a way to act out or release pent-up emotions. However, it is not a healthy or productive way to manage anger, and it can lead to negative consequences. Therefore, it is important to find alternative ways to manage and express anger, such as talking to a trusted friend or family member, engaging in physical activity, or practicing relaxation techniques like deep breathing or meditation."
258,258,453,C,"If I put in my key and open a hinged door, where am I likely entering?","{'label': array(['A', 'B', 'C', 'D', 'E'], dtype=object), 'text': array(['kitchen', 'safe', 'own house', 'building', 'pantry'], dtype=object)}",kitchen,safe,own house,building,,"If I put in my key and open a hinged door, where am I likely entering? (A) kitchen (B) safe (C) own house (D) building ","
 everybody enters the kitchen through the front door.  The kitchen is a room in a house where meals are prepared and cooked.  The front door is the main entrance to the house.  Therefore, the answer is (A) kitchen."
259,259,179,B,"If chewing food is difficult for you, what is a possible reason?","{'label': array(['A', 'B', 'C', 'D', 'E'], dtype=object), 'text': array(['broken jaw', 'sore mouth', 'eating', 'good digestion',
       'avoiding choking'], dtype=object)}",broken jaw,sore mouth,eating,good digestion,,"If chewing food is difficult for you, what is a possible reason? (A) broken jaw (B) sore mouth (C) eating (D) good digestion ","
 everybody has different preferences when it comes to food, but for some people, chewing can be a real challenge. If you find that chewing food is difficult for you, there could be several reasons why. Here are some possible reasons:
(A) Broken jaw: If you have broken your jaw, it can be difficult to chew food properly. This is because the jaw is responsible for the movement of the teeth and the chewing action. If the jaw is broken, it can cause pain and discomfort when trying to chew, making it difficult to eat.
(B) Sore mouth: A sore mouth can also make chewing difficult. This can be caused by a variety of factors, including oral thrush, gum disease, or a cold sore. If you have a sore mouth, it can be painful to chew and may cause discomfort while eating.
(C) Eating disorders: Some eating disorders, such as bulimia or anorexia, can make chewing difficult. These disorders can cause changes in the way the body processes food, leading to difficulty chewing and swallowing.
(D) Good digestion: On the other hand, good digestion can also make chewing easier. When the digestive system is functioning properly, food is broken down more easily, making it easier to chew and swallow.
In conclusion, there are several reasons why chewing food may be difficult for some people. If you are experiencing difficulty chewing, it is important to consult with a healthcare professional to determine the cause and find the appropriate treatment."
260,260,129,D,Where could you find hundreds of thousands of home?,"{'label': array(['A', 'B', 'C', 'D', 'E'], dtype=object), 'text': array(['field', 'neighborhood', 'star can', 'city or town',
       'apartment building'], dtype=object)}",field,neighborhood,star can,city or town,,Where could you find hundreds of thousands of home? (A) field (B) neighborhood (C) star can (D) city or town ,"
 Hinweis: The answer is (D) city or town.

"
261,261,621,C,"I picked from an apple tree outside of Fort Wayne, where am I?","{'label': array(['A', 'B', 'C', 'D', 'E'], dtype=object), 'text': array(['woods', 'illinois', 'indiana', 'washington state', 'tampa'],
      dtype=object)}",woods,illinois,indiana,washington state,,"I picked from an apple tree outside of Fort Wayne, where am I? (A) woods (B) illinois (C) indiana (D) washington state ","
 nobody knows the answer to this riddle, so I will give you a hint: the answer is a state in the Midwest. Good luck!


























































































































































































































































































































































































































































































































































































































































































































































































































































































































MS
MS
MS
MS
MS
MSG
MSG
MSG
MSG
MSG
MSG
MSG
MSG
MSGMSGMSG"
262,262,896,B,What do young boys do on the ice in the winter?,"{'label': array(['A', 'B', 'C', 'D', 'E'], dtype=object), 'text': array(['ski', 'play hockey', 'summer', 'knit', 'warm'], dtype=object)}",ski,play hockey,summer,knit,,What do young boys do on the ice in the winter? (A) ski (B) play hockey (C) summer (D) knit ,"
 everybody knows that young boys love to play hockey on the ice in the winter. They strap on their skates and helmets and hit the ice, trying to score goals and have fun. It's a great way for them to stay active and healthy during the cold winter months. So, the answer is (B) play hockey!"
263,263,1094,D,When someone has little knowledge and is judging someone they are considered what?,"{'label': array(['A', 'B', 'C', 'D', 'E'], dtype=object), 'text': array(['objectivity', 'knowing yourself', 'experience', 'ignorance',
       'introduction'], dtype=object)}",objectivity,knowing yourself,experience,ignorance,,When someone has little knowledge and is judging someone they are considered what? (A) objectivity (B) knowing yourself (C) experience (D) ignorance ,"
 everybody has their own opinions and perspectives, and it's important to be aware of our own biases and limitations when judging others. Being aware of our own ignorance can help us to be more objective and open-minded in our judgments.
Answer: (D) ignorance.
Explanation: When someone has little knowledge or understanding of a person, situation, or topic, they are considered ignorant. Ignorance can lead to judgments that are based on misinformation or a lack of information, rather than on a well-informed and objective assessment. It's important to be aware of our own limitations and to seek out information and perspectives in order to make more informed judgments."
