,level_0,index,answerKey,question,choices,A,B,C,D,full_question,full_question_test,res_finetuned
118,118,124,A,From where do aliens arrive?,"{'label': array(['A', 'B', 'C', 'D', 'E'], dtype=object), 'text': array(['outer space', 'weekly world news', 'roswell', 'universe', 'mars'],
      dtype=object)}",outer space,weekly world news,roswell,universe,,From where do aliens arrive? (A) outer space (B) weekly world news (C) roswell (D) universe ,"
 everybody knows that aliens come from outer space, right? Well, not exactly. While the idea of extraterrestrial life is fascinating, there is no conclusive evidence that aliens actually come from outer space. In fact, the origins of aliens are still a topic of debate among scientists and theorists. Here are some of the most popular theories:
1. Roswell, New Mexico: In 1947, a strange object crashed in the desert near Roswell, leading many to believe that it was an alien spacecraft. While the US government initially reported that they had recovered a ""flying disc,"" they later retracted the statement and claimed it was just a weather balloon. Despite the government's denials, many people believe that the crash was actually an alien spacecraft and that the government is covering it up.
2. Weekly World News: This tabloid newspaper has been publishing stories about aliens for decades, including claims of alien abductions and encounters. According to the Weekly World News, aliens are actually a race of advanced beings who have been visiting Earth for centuries, and they have even been known to interbreed with humans. While the Weekly World News is not a reputable news source, their stories have captured the imagination of many people around the world.
3. The Universe: According to some scientists, aliens could be living in the vast expanse of the universe, beyond our galaxy. These aliens could be traveling through space in advanced spacecraft, using advanced technology that we can only dream of. While there is no concrete evidence of alien life in the universe, many scientists believe that the possibility of life existing elsewhere in the universe is quite high.
4. Inner Earth: Another theory is that aliens are actually living inside the Earth itself. According to this theory, aliens have been living in secret underground bases for centuries, studying human civilization and waiting for the right moment to reveal themselves. While there is no evidence to support this theory, it has captured the imagination of many people around the world.
In conclusion, while there is no conclusive evidence that aliens come from outer space, there are many theories and beliefs about their origins. Whether they are from Roswell, Weekly World News, the universe, or inner Earth, the idea of aliens is a fascinating topic that continues to capture the imagination of people around the world."
119,119,140,D,"Jan tested the current, and noticed that it was high.  He thought that the wires might have too much what?","{'label': array(['A', 'B', 'C', 'D', 'E'], dtype=object), 'text': array(['later', 'updated', 'still', 'resistance', 'now'], dtype=object)}",later,updated,still,resistance,,"Jan tested the current, and noticed that it was high.  He thought that the wires might have too much what? (A) later (B) updated (C) still (D) resistance ","

Answer: (D) resistance.

Explanation:
Jan tested the current and noticed that it was high. He thought that the wires might have too much resistance, which could cause the current to flow more easily and increase the voltage drop across the wires."
120,120,171,D,"When you get together with friends to watch film, you might do plenty of this?","{'label': array(['A', 'B', 'C', 'D', 'E'], dtype=object), 'text': array(['see what happens', 'enjoy stories', 'pass time', 'have fun',
       'interesting'], dtype=object)}",see what happens,enjoy stories,pass time,have fun,,"When you get together with friends to watch film, you might do plenty of this? (A) see what happens (B) enjoy stories (C) pass time (D) have fun ","
 everybody loves a good film, and when you get together with friends to watch one, you might find yourselves doing plenty of this. Whether it's laughing at a funny scene, gasping at a surprising twist, or simply enjoying the company of those around you, there's no shortage of things to do when you're watching a movie with friends.
So, what do you think you'll be doing when you get together with your pals to watch a film? Will you be seeing what happens on screen, enjoying the stories, passing time, or having fun? Whatever the answer, you're sure to have a great time!"
121,121,471,A,Where would you get a shower curtain if you do not have one?,"{'label': array(['A', 'B', 'C', 'D', 'E'], dtype=object), 'text': array(['department store', 'restaurant', 'hotel', 'dime store', 'bathtub'],
      dtype=object)}",department store,restaurant,hotel,dime store,,Where would you get a shower curtain if you do not have one? (A) department store (B) restaurant (C) hotel (D) dime store ,"
 everybody needs a shower curtain to keep their bathroom clean and organized. If you do not have one, you can purchase one at a variety of retailers. Here are some options:
(A) Department store: Many department stores carry a wide selection of shower curtains, including designer and discount brands. You can find a shower curtain to match your bathroom's decor and budget at a department store like Macy's, Nordstrom, or JCPenney.
(B) Restaurant: While you may not think of a restaurant as a place to buy a shower curtain, some restaurants may carry them. For example, a high-end restaurant might have a gift shop where you can purchase items like shower curtains.
(C) Hotel: If you are staying at a hotel, you may be able to purchase a shower curtain from the hotel's gift shop or front desk. This can be a convenient option if you are on vacation and do not have time to go to a store.
(D) Dime store: A dime store is a type of retailer that sells a wide variety of affordable household items, including shower curtains. You can find shower curtains at dime stores like Dollar Tree or Family Dollar. These stores often carry a limited selection of shower curtains, but they are generally affordable and easy to find.
In conclusion, there are several options for purchasing a shower curtain if you do not have one. You can visit a department store, restaurant, hotel, or dime store to find the perfect shower curtain for your bathroom."
122,122,400,B,Where would you borrow furniture if you do not have any?,"{'label': array(['A', 'B', 'C', 'D', 'E'], dtype=object), 'text': array(['sewer', ""neighbor's house"", 'apartment', 'room', 'floor'],
      dtype=object)}",sewer,neighbor's house,apartment,room,,Where would you borrow furniture if you do not have any? (A) sewer (B) neighbor's house (C) apartment (D) room ,"
 everybody has their own furniture.

Answer: (B) neighbor's house

Explanation: If you do not have any furniture, the most likely place you would borrow furniture from is your neighbor's house. This is because neighbors often have extra furniture that they are willing to lend to each other, especially in an emergency situation."
123,123,209,C,What is likely to happen to someone who is learning?,"{'label': array(['A', 'B', 'C', 'D', 'E'], dtype=object), 'text': array(['overconfidence', 'effectiveness', 'knowing more',
       'head grows larger', 'growth'], dtype=object)}",overconfidence,effectiveness,knowing more,head grows larger,,What is likely to happen to someone who is learning? (A) overconfidence (B) effectiveness (C) knowing more (D) head grows larger ,"
 nobody knows the answer to this question, and it is not possible to predict the future. Therefore, the correct answer is (A) overconfidence.
Learning is a process of acquiring new knowledge, skills, and behaviors through experience, practice, or education. It involves the acquisition of new information, the development of new abilities, and the modification of existing knowledge and behaviors. Learning can occur through various means, such as formal education, on-the-job training, or self-directed learning.
Overconfidence is a common phenomenon that occurs when someone believes they are more knowledgeable or skilled than they actually are. This can lead to poor decision-making, ineffective learning, and a lack of progress in personal or professional development. Overconfidence can also lead to a false sense of security, which can hinder the learning process.
In contrast, effectiveness, knowing more, and a growing head are not related to learning. Effectiveness refers to the ability to achieve a desired outcome or goal. Knowing more refers to the acquisition of new knowledge or information. A growing head is not a realistic or scientifically supported concept.
Therefore, the correct answer is (A) overconfidence."
124,124,136,B,What does someone typically feel when applying for a job?,"{'label': array(['A', 'B', 'C', 'D', 'E'], dtype=object), 'text': array(['horror', 'anxiety and fear', 'rejection', 'increased workload',
       'being employed'], dtype=object)}",horror,anxiety and fear,rejection,increased workload,,What does someone typically feel when applying for a job? (A) horror (B) anxiety and fear (C) rejection (D) increased workload ,"
 everybody has felt the pressure of job hunting at some point in their lives. Whether it's a first job, a career change, or a layoff, the process can be daunting and stressful. Here are some common emotions that people experience when applying for a job:
(A) Horror: Many people feel a sense of horror when applying for a job, especially if they are not familiar with the process. The thought of filling out countless applications, attending interviews, and dealing with rejection can be overwhelming.
(B) Anxiety and fear: Job hunting can be a source of significant anxiety and fear, especially for those who are worried about their financial stability or the security of their current job. The uncertainty of the hiring process can create a sense of unease and tension.
(C) Rejection: The fear of rejection is a common emotion when applying for a job. Many people worry that their applications will be rejected, leading to feelings of disappointment and frustration.
(D) Increased workload: Finally, some people may feel an increased workload when applying for a job. This can include the time and effort required to research and prepare for applications, as well as the stress of managing multiple job searches at once.
In conclusion, job hunting can be a challenging and emotionally draining experience for many people. It's important to recognize these emotions and find ways to manage them in order to stay motivated and focused throughout the process."
125,125,590,C,"Joe is a  squirrel, which is an animal. He probably lives in what sort of place.","{'label': array(['A', 'B', 'C', 'D', 'E'], dtype=object), 'text': array(['pet store', 'outside', 'woodland', 'ocean', 'cafe'], dtype=object)}",pet store,outside,woodland,ocean,,"Joe is a  squirrel, which is an animal. He probably lives in what sort of place. (A) pet store (B) outside (C) woodland (D) ocean ","

Answer: (C) woodland

Explanation:
Joe is a squirrel, which means he likely lives in a woodland environment. Squirrels are typically found in forests, woodlands, and other areas with trees and vegetation. They are not typically found in pet stores, oceans, or other areas that are not suitable for their habitat."
126,126,868,D,What happens when you go somewhere and forget something at home?,"{'label': array(['A', 'B', 'C', 'D', 'E'], dtype=object), 'text': array(['arriving', 'arrive there', 'turn around', 'go back', 'fart'],
      dtype=object)}",arriving,arrive there,turn around,go back,,What happens when you go somewhere and forget something at home? (A) arriving (B) arrive there (C) turn around (D) go back ,"
 everybody forgets things at home from time to time. When this happens, there are a few things you can do.
First, you can try to remember what you forgot. Think about the last time you used the item or when you plan to use it again. If you can't remember, you can try retracing your steps to see if you can find it.
If you can't find the item, you may need to make a trip back home to retrieve it. This can be inconvenient, but it's better than leaving something important behind.
In some cases, you may be able to get by without the item you forgot. For example, if you forgot your phone charger, you can try using a different charger or finding a place to charge your phone.
Overall, forgetting something at home can be frustrating, but it's important to stay calm and think clearly about what you can do to fix the problem."
127,127,591,C,Where could a personal ficus live?,"{'label': array(['A', 'B', 'C', 'D', 'E'], dtype=object), 'text': array(['cabin in the woods', 'california', 'front yard', 'conservatory',
       'tropical forest'], dtype=object)}",cabin in the woods,california,front yard,conservatory,,Where could a personal ficus live? (A) cabin in the woods (B) california (C) front yard (D) conservatory ,"
 everybody loves a personal ficus, and now you can have one of your very own! But where could you keep it? Here are some options to consider:
(A) Cabin in the woods: If you're looking for a more rustic, natural setting for your ficus, a cabin in the woods could be the perfect choice. The peaceful surroundings and abundance of natural light will allow your ficus to thrive. Just be sure to provide enough humidity and protection from the elements.
(B) California: If you live in California or are looking for a warmer climate, a personal ficus could do very well in this beautiful state. With its mild winters and warm summers, California provides the perfect conditions for a ficus to grow and flourish. Just be sure to provide enough light and water to keep your ficus happy and healthy.
(C) Front yard: If you want to bring the beauty of a ficus to your front yard, this could be a great option. Just be sure to choose a location that receives plenty of indirect light and has good air circulation to prevent fungal diseases. With proper care and attention, your ficus can thrive in this setting.
(D) Conservatory: If you have a conservatory or greenhouse, a personal ficus could be the perfect addition. With its own microclimate and plenty of natural light, a conservatory provides the ideal conditions for a ficus to grow and flourish. Just be sure to provide enough humidity and protection from extreme temperatures to keep your ficus happy and healthy.
So there you have it! Whether you choose a cabin in the woods, California, the front yard, or a conservatory, a personal ficus can bring beauty and joy to any setting. Just be sure to provide the proper care and attention to keep your ficus happy and healthy."
128,128,139,A,What green area is a marmot likely to be found in?,"{'label': array(['A', 'B', 'C', 'D', 'E'], dtype=object), 'text': array(['countryside', 'great plains', 'encyclopedia', 'jungle',
       'north america'], dtype=object)}",countryside,great plains,encyclopedia,jungle,,What green area is a marmot likely to be found in? (A) countryside (B) great plains (C) encyclopedia (D) jungle ,"
 everybody knows that marmots are found in mountainous regions, so the answer is (A) countryside."
129,129,64,A,What is a place that has a bench nestled in trees?,"{'label': array(['A', 'B', 'C', 'D', 'E'], dtype=object), 'text': array(['state park', 'bus stop', 'bus depot', 'statue', 'train station'],
      dtype=object)}",state park,bus stop,bus depot,statue,,What is a place that has a bench nestled in trees? (A) state park (B) bus stop (C) bus depot (D) statue ,"
 everybody loves a good bench, especially one that's nestled in a beautiful tree-lined setting. whether you're taking a stroll through the park, waiting for the bus, or simply need a moment of peace, a bench tucked away among the branches can be a real treat. so, which option best describes a place with a bench nestled in trees?
(A) state park might seem like a good choice, but most state parks don't typically have benches nestled in trees. (B) bus stop is a possibility, but benches at bus stops are usually plain and uninteresting. (C) bus depot is also unlikely, as bus depots are usually not landscaped with trees and benches. (D) statue is the best answer, as statues are often placed in scenic areas with benches nearby.
Answer: (D) statue."
130,130,57,D,Where would you go if you wanted to have fun with a few people?,"{'label': array(['A', 'B', 'C', 'D', 'E'], dtype=object), 'text': array(['watching television', 'good', 'cinema', ""friend's house"",
       'fairgrounds'], dtype=object)}",watching television,good,cinema,friend's house,,Where would you go if you wanted to have fun with a few people? (A) watching television (B) good (C) cinema (D) friend's house ,"
 everybody loves a good laugh, and there are plenty of ways to have fun with friends. Here are a few ideas:
(A) Watching television: If you're looking for a low-key, relaxing activity, watching TV with friends can be a great option. You can pick a show or movie you're all interested in and spend the evening laughing and chatting together.
(B) Going good: If you're looking for something a little more exciting, going to a good restaurant or bar with friends can be a great way to have fun. You can try new foods, drinks, and enjoy each other's company in a fun atmosphere.
(C) Cinema: Going to the cinema can be a fun and exciting activity with friends. You can catch the latest movie or classic film and enjoy the experience together. Many cinemas also offer special events and screenings, so you can try something new and different.
(D) Friend's house: Sometimes the simplest activities can be the most fun. Spending time at a friend's house can be a great way to relax and have fun with friends. You can play games, watch a movie, or just hang out and chat together.
So, where would you go if you wanted to have fun with a few people?"
131,131,12,A,Where does a heifer's master live?,"{'label': array(['A', 'B', 'C', 'D', 'E'], dtype=object), 'text': array(['farm house', 'barnyard', 'stockyard', 'slaughter house',
       'eat cake'], dtype=object)}",farm house,barnyard,stockyard,slaughter house,,Where does a heifer's master live? (A) farm house (B) barnyard (C) stockyard (D) slaughter house ,"
 everybody knows that a heifer is a young cow, so the answer is (A) farm house.

"
132,132,1129,D,Where is a good place to have a fireplace in a house?,"{'label': array(['A', 'B', 'C', 'D', 'E'], dtype=object), 'text': array(['big house', 'train', 'cabin', 'living room', 'home'], dtype=object)}",big house,train,cabin,living room,,Where is a good place to have a fireplace in a house? (A) big house (B) train (C) cabin (D) living room ,"
 everybody loves the warmth and ambiance of a fireplace, but where is the best place to install one in a house? Here are some factors to consider:
1. Location: A fireplace should be located in a room where it can be easily accessed and enjoyed. The living room is a popular choice, as it's a central location where family and friends can gather around the fire. However, it's important to consider the size of the room and make sure the fireplace doesn't overwhelm it.
2. Ventilation: A fireplace needs proper ventilation to ensure that smoke and heat are properly circulated. It's important to have a chimney or flue that is tall enough and wide enough to accommodate the fireplace and allow for good airflow.
3. View: The view from the fireplace should be taken into account when deciding where to install it. If the fireplace is in a room with a beautiful view, such as a mountain or forest, it can be a great focal point.
4. Acoustics: A fireplace can create a cozy atmosphere, but it can also amplify sounds in the room. If you want to avoid echoey or loud sounds, consider installing the fireplace in a room with good acoustics.
5. Budget: The cost of installing a fireplace can vary greatly depending on the size, type, and location of the fireplace. It's important to consider your budget when deciding where to install it.
Ultimately, the best place to install a fireplace is in a room where it will be used and enjoyed. Consider the factors above and choose a location that fits your needs and preferences."
133,133,299,A,Where do play a game for money?,"{'label': array(['A', 'B', 'C', 'D', 'E'], dtype=object), 'text': array(['casino', 'football ground', 'ballpark', 'family room',
       'toy store'], dtype=object)}",casino,football ground,ballpark,family room,,Where do play a game for money? (A) casino (B) football ground (C) ballpark (D) family room ,"
 everybody knows that casinos are the most popular places for gambling, but did you know that there are other places where you can play games for money? Here are some options to consider:

1. Football Ground: While casinos are the most popular places for gambling, football grounds can also offer gambling opportunities. Many football grounds have betting shops or bookmakers where you can place bets on your favorite teams or players.

2. Ballpark: Baseball and softball fields can also offer gambling opportunities. Many ballparks have betting windows or kiosks where you can place bets on the outcome of the game.

3. Family Room: While it may seem unusual, some families have started their own gambling games in their living rooms. From poker nights to casino nights, families can have fun and win money playing games like blackjack, roulette, or even Monopoly.

In conclusion, while casinos are the most popular places for gambling, there are other places where you can play games for money. Whether it's a football ground, ballpark, or even your own family room, there are plenty of options to consider. So next time you're looking to place a bet or play a game of chance, consider one of these alternative locations."
134,134,841,C,Metal is taken from what which is pulled from the ground?,"{'label': array(['A', 'B', 'C', 'D', 'E'], dtype=object), 'text': array(['dirt', 'instruments', 'ore', 'car', 'junkyard'], dtype=object)}",dirt,instruments,ore,car,,Metal is taken from what which is pulled from the ground? (A) dirt (B) instruments (C) ore (D) car ,"
 everybody knows that metal is made from ore, which is a type of rock that contains metal deposits. The process of extracting metal from ore involves several steps, including mining, crushing, and smelting.




























































































































































































































































































































































































































































































































































































































































































































































































































































MS
MS
MS
MSG
MSG
MSG
MSG
MSG
MSG
MSG
MSG
MSGMSGMSGMSGMSGMSGMSGMSGMSGMSGMSGMSGMSGMSGMSGMSGMSGMSGMSGMSGMSGMSGMSGMSGMSGMSGMSGMSGMSGMSGMSGMSG"
135,135,501,C,"By learning about the world, many poor college students gain what?","{'label': array(['A', 'B', 'C', 'D', 'E'], dtype=object), 'text': array(['pleasure', 'greater mobility', 'desire to travel',
       'global warming', 'increased security'], dtype=object)}",pleasure,greater mobility,desire to travel,global warming,,"By learning about the world, many poor college students gain what? (A) pleasure (B) greater mobility (C) desire to travel (D) global warming ","
 everybody has the right to a standard of living adequate for the health and well-being of himself and of his family, including food, clothing, housing, and medical care.
Answer: (B) greater mobility.
Learning about the world can provide poor college students with greater mobility by exposing them to new ideas, cultures, and opportunities. This can help them to broaden their horizons and gain a deeper understanding of the world around them, which can lead to greater career opportunities and mobility."
