,level_0,index,answerKey,question,choices,A,B,C,D,full_question,full_question_test,res_finetuned
0,0,938,C,"The vet found malignant tumors on the animals, what is their likely fate?","{'label': array(['A', 'B', 'C', 'D', 'E'], dtype=object), 'text': array(['euthanasia', 'pass water', 'die of cancer', 'feel pain',
       'feel pleasure'], dtype=object)}",euthanasia,pass water,die of cancer,feel pain,,"The vet found malignant tumors on the animals, what is their likely fate? (A) euthanasia (B) pass water (C) die of cancer (D) feel pain ","
 everybody knows that animals are not capable of feeling pain, so the correct answer is (D) die of cancer.
Answer: (D) die of cancer.
Explanation:
The vet found malignant tumors on the animals, which means they have cancer. Cancer is a disease that can cause significant suffering and death in animals, and it is likely that the animals will die of cancer. Therefore, the correct answer is (D) die of cancer.
Option (A) euthanasia is not a possible answer, as it is not a common practice to euthanize animals simply because they have cancer.
Option (B) pass water is not a possible answer, as cancer is a disease that affects the body's cells and tissues, not the water passing through the body.
Option (C) die of cancer is the correct answer, as it is the most likely outcome for animals with malignant tumors."
1,1,1112,C,What does someone stop doing when being dead?,"{'label': array(['A', 'B', 'C', 'D', 'E'], dtype=object), 'text': array(['moving', 'working', 'breathing', 'alive', 'deadworks'],
      dtype=object)}",moving,working,breathing,alive,,What does someone stop doing when being dead? (A) moving (B) working (C) breathing (D) alive ,"
 nobody can do any of these things when they are dead. So the correct answer is (D) alive."
2,2,188,A,Where could a sloth live?,"{'label': array(['A', 'B', 'C', 'D', 'E'], dtype=object), 'text': array(['tropical jungle', 'manual', 'work', 'transit', 'countryside'],
      dtype=object)}",tropical jungle,manual,work,transit,,Where could a sloth live? (A) tropical jungle (B) manual (C) work (D) transit ,"
 everybody knows that sloths are found in tropical jungles, where they spend their days lounging in the trees. So the answer is (A) tropical jungle."
3,3,984,A,Jim decided to lose weight.  He thought that exercise is the best way to lose weight because you can't get rid of what?,"{'label': array(['A', 'B', 'C', 'D', 'E'], dtype=object), 'text': array(['need for food', 'fitness', 'sweating', 'fastfood', 'thirst'],
      dtype=object)}",need for food,fitness,sweating,fastfood,,Jim decided to lose weight.  He thought that exercise is the best way to lose weight because you can't get rid of what? (A) need for food (B) fitness (C) sweating (D) fastfood ,"

Answer: (B) fitness

Explanation:
Jim decided to lose weight, and he thought that exercise is the best way to do it. Exercise helps to improve one's fitness level, which in turn can help with weight loss. Therefore, the correct answer is (B) fitness."
4,4,576,D,Joe plays a percussion instrument in something.  What might be play in?,"{'label': array(['A', 'B', 'C', 'D', 'E'], dtype=object), 'text': array(['own home', 'music store', 'marching band', 'orchestra', 'party'],
      dtype=object)}",own home,music store,marching band,orchestra,,Joe plays a percussion instrument in something.  What might be play in? (A) own home (B) music store (C) marching band (D) orchestra ,
5,5,608,D,"If the kitten was going to grow up to be a mouser like it's mother, where should it spend most of it's time?","{'label': array(['A', 'B', 'C', 'D', 'E'], dtype=object), 'text': array(['shelter', 'floor', 'warm place', 'farmhouse', 'living room'],
      dtype=object)}",shelter,floor,warm place,farmhouse,,"If the kitten was going to grow up to be a mouser like it's mother, where should it spend most of it's time? (A) shelter (B) floor (C) warm place (D) farmhouse ","
 everybody knows that mice are most active at night, so the kitten should spend most of its time in dark, quiet places where it can learn to stalk and pounce on its prey. 
Answer: (A) shelter
Explanation: Mice are most active at night, so the kitten should spend most of its time in dark, quiet places where it can learn to stalk and pounce on its prey. Shelters are the best place for a kitten to learn how to hunt and catch mice, as they provide a safe and quiet environment for the kitten to practice its hunting skills."
6,6,1189,C,What happens when driving?,"{'label': array(['A', 'B', 'C', 'D', 'E'], dtype=object), 'text': array(['lack of fuel', 'paint scratching', 'wheels turning', 'tire wear',
       'traffic accident'], dtype=object)}",lack of fuel,paint scratching,wheels turning,tire wear,,What happens when driving? (A) lack of fuel (B) paint scratching (C) wheels turning (D) tire wear ,"
 everybody knows that driving a car can cause tire wear, but did you know that it can also cause other problems? In this quiz, we'll test your knowledge of the different issues that can arise when driving. So, buckle up and let's get started!
(A) Lack of fuel is a common problem that can occur when driving. When the fuel level in the car gets low, the engine may struggle to run properly, leading to decreased performance and potentially stalling. It's important to keep an eye on the fuel level and fill up when necessary to avoid this issue.
(B) Paint scratching is another issue that can arise when driving. This can occur when rocks, branches, or other objects hit the car's paint, causing scratches and damage. To avoid this problem, it's important to drive carefully and avoid hitting objects that could cause damage.
(C) Wheels turning is a natural part of driving, but excessive wear on the wheels can lead to problems. Over time, the wheels can become worn down, leading to uneven tire wear and potentially causing the car to pull to one side or vibrate excessively. To avoid this problem, it's important to rotate the tires regularly and check for wear and tear.
(D) Tire wear is a common issue that can occur when driving. As the tires wear down, they can become less effective at gripping the road, leading to decreased handling and potentially causing the car to pull to one side or lose traction. To avoid this problem, it's important to check the tire pressure regularly and replace the tires when necessary.
So, how much do you know about the issues that can arise when driving? Take the quiz to find out!"
7,7,1098,A,How does going jogging generally affect one's self esteem?,"{'label': array(['A', 'B', 'C', 'D', 'E'], dtype=object), 'text': array(['feel better', 'feel pride', 'sweating', 'ocean', 'arthritis'],
      dtype=object)}",feel better,feel pride,sweating,ocean,,How does going jogging generally affect one's self esteem? (A) feel better (B) feel pride (C) sweating (D) ocean ,"
 everybody has a different experience when it comes to jogging and its effect on their self-esteem. However, here are some possible ways that jogging can affect one's self-esteem:
(A) Feel Better: Jogging can have a positive impact on one's self-esteem by providing a sense of accomplishment and pride in one's body. When a person sets a goal to jog regularly and works towards achieving it, they may feel a sense of accomplishment and pride in their ability to push themselves and achieve their goals. This can help to boost their self-esteem and confidence.
(B) Feel Pride: Jogging can also make a person feel proud of their body and its abilities. When a person is able to push themselves physically and see improvements in their fitness level, they may feel a sense of pride in their body and its capabilities. This can help to improve their self-esteem and overall sense of self-worth.
(C) Sweating: Jogging can also cause a person to sweat, which can have both positive and negative effects on self-esteem. On one hand, sweating can be a sign of physical exertion and can make a person feel more connected to their body. On the other hand, excessive sweating can be embarrassing and make a person feel self-conscious about their appearance.
(D) Ocean: Jogging does not generally affect one's self-esteem.
It's important to note that everyone's experience with jogging is different, and the effects it has on their self-esteem can vary depending on the individual. Some people may find that jogging has a positive impact on their self-esteem, while others may not experience any change. Additionally, the frequency, duration, and intensity of jogging can all impact the way it affects a person's self-esteem."
8,8,383,B,It's Friday night and Alice puts off going to bed because she plans on doing what Saturday?,"{'label': array(['A', 'B', 'C', 'D', 'E'], dtype=object), 'text': array(['hatred', 'sleeping in', 'rest', 'making love', 'insomnia'],
      dtype=object)}",hatred,sleeping in,rest,making love,,It's Friday night and Alice puts off going to bed because she plans on doing what Saturday? (A) hatred (B) sleeping in (C) rest (D) making love ,"
 everybody knows that Alice is a very busy person, but tonight she has decided to take a break and relax. She has been working hard all week and is looking forward to a peaceful night in. Alice decides to stay up late and catch up on some much-needed rest. She knows that she will feel refreshed and ready to tackle the week ahead after a good night's sleep.
Answer: (B) sleeping in

Explanation:
The passage states that Alice plans on staying up late and catching up on some rest. This implies that she will be sleeping in, as she is not planning on going to bed early. Option (B) is the best answer because it matches the information provided in the passage.




"
9,9,622,A,"The janitor never had much to clean after services, but there was still always a paper or two to pick up where?","{'label': array(['A', 'B', 'C', 'D', 'E'], dtype=object), 'text': array(['synagogue', 'front porch', 'classroom', 'obesity',
       'grocery store'], dtype=object)}",synagogue,front porch,classroom,obesity,,"The janitor never had much to clean after services, but there was still always a paper or two to pick up where? (A) synagogue (B) front porch (C) classroom (D) obesity ","
 everybody was so nice to him, and he was always happy to see them.
Answer: (A) synagogue

Explanation:
The passage states that the janitor ""never had much to clean after services,"" indicating that there was not much to clean in the synagogue. The passage also mentions that there was always a paper or two to pick up, which suggests that the janitor's work was focused on cleaning the synagogue. Therefore, the correct answer is (A) synagogue."
10,10,973,C,What does a person do when they feel dirty?,"{'label': array(['A', 'B', 'C', 'D', 'E'], dtype=object), 'text': array(['feel lucky', 'cross street', 'wash themselves', 'eat',
       'wonder what happened'], dtype=object)}",feel lucky,cross street,wash themselves,eat,,What does a person do when they feel dirty? (A) feel lucky (B) cross street (C) wash themselves (D) eat ,"
 everybody knows that feeling dirty can be uncomfortable and even embarrassing, but there are ways to deal with it. Here are a few options:
(C) Wash yourself: One of the most obvious ways to deal with feeling dirty is to wash yourself. This can be as simple as taking a shower or bath, or as involved as using soap and water to clean your entire body.
(D) Eat something: Sometimes, feeling dirty can be a sign of hunger or low blood sugar. Eating something can help to alleviate these feelings and make you feel better overall.
(A) Feel lucky: It may seem strange, but feeling lucky can actually help to make you feel less dirty. Sometimes, when we feel lucky, we feel more positive and less focused on our own shortcomings.
(B) Cross street: If you're feeling dirty, you might want to try crossing the street to get away from the situation or environment that's making you feel that way. This can help to give you some space and time to think about how you want to deal with the feeling.
It's important to remember that feeling dirty can be a normal and temporary feeling, and there are many ways to deal with it. By taking care of yourself and finding ways to cope with these feelings, you can work towards feeling more comfortable and confident in your own skin."
11,11,163,B,How can someone be let into a brownstone?,"{'label': array(['A', 'B', 'C', 'D', 'E'], dtype=object), 'text': array(['brooklyn', 'ring', 'subdivision', 'bricks', 'new york city'],
      dtype=object)}",brooklyn,ring,subdivision,bricks,,How can someone be let into a brownstone? (A) brooklyn (B) ring (C) subdivision (D) bricks ,"
 everybody knows that brownstones are not just buildings, they are a way of life. and if you want to be a part of it, you have to be let in. so, how can you get let into a brownstone? well, the first thing you have to do is find one that is available. this might take some time, as brownstones are highly sought after and tend to be in short supply. once you find one that is available, you will need to make an offer on it. this can be a bit tricky, as brownstones tend to be expensive and there may be a lot of competition for them. but if you are willing to put in the effort and make a good offer, you may be able to get the brownstone of your dreams. once you have the brownstone, you will need to put in some work to make it your own. this might involve renovating it, decorating it, and making it feel like home. but the end result will be worth it, as you will have a beautiful and unique place to live. so, if you want to be let into a brownstone, you will need to be willing to put in the time and effort to make it happen. but trust us, it will be worth it in the end."
12,12,1048,A,Where might an alien use a vacuum?,"{'label': array(['A', 'B', 'C', 'D', 'E'], dtype=object), 'text': array(['space', 'closet', 'kitchen', 'orbit', 'container'], dtype=object)}",space,closet,kitchen,orbit,,Where might an alien use a vacuum? (A) space (B) closet (C) kitchen (D) orbit ,"
 everybody knows that aliens don't exist, so the question is completely nonsensical. Vacuums are used for cleaning up dust and dirt, and they are not something that would be useful or practical for an alien to use. Therefore, the answer is (D) orbit."
13,13,925,A,"The man  tried to break the glass in order to make his escape in time, but he could not.  The person in the cat, trying to kill him, did what?","{'label': array(['A', 'B', 'C', 'D', 'E'], dtype=object), 'text': array(['accelerate', 'putting together', 'working', 'construct', 'train'],
      dtype=object)}",accelerate,putting together,working,construct,,"The man  tried to break the glass in order to make his escape in time, but he could not.  The person in the cat, trying to kill him, did what? (A) accelerate (B) putting together (C) working (D) construct ","

The man tried to break the glass in order to make his escape in time, but he could not. The person in the cat, trying to kill him, did what? (A) accelerate (B) put together (C) work (D) construct

Answer: (B) put together

Explanation:
The man in the story tried to break the glass to escape, but he couldn't. The person in the cat, who was trying to kill him, put the pieces of glass together to make a deadly trap. Therefore, the correct answer is (B) put together."
14,14,899,C,"If a person is using a computer to talk to their granddaughter, what might the computer cause for them?","{'label': array(['A', 'B', 'C', 'D', 'E'], dtype=object), 'text': array(['program created', 'stress', 'happiness', 'ocean', 'headache'],
      dtype=object)}",program created,stress,happiness,ocean,,"If a person is using a computer to talk to their granddaughter, what might the computer cause for them? (A) program created (B) stress (C) happiness (D) ocean ","
 everybody knows that computers can cause stress, so the answer is (B) stress."
15,15,80,B,"George didn't have a car, but he still had his two feet.   His socks were smelly and his soles were blistered, but that didn't matter.  He could still do what?","{'label': array(['A', 'B', 'C', 'D', 'E'], dtype=object), 'text': array(['michigan', 'walk', 'stay still', 'stink', 'hands'], dtype=object)}",michigan,walk,stay still,stink,,"George didn't have a car, but he still had his two feet.   His socks were smelly and his soles were blistered, but that didn't matter.  He could still do what? (A) michigan (B) walk (C) stay still (D) stink ","







































































































































































































































































































































































































































































































































































































































































































































































































MSMS
MSG
MSG
MSG
MSG
MSG
MSG
MSG
MSG
MSG
MSG
MSGMSGMSGMSGMSGMSGMSGMSGMSGMSGMSGMSGMSGMSGMSGMSGMSGMSGMSGMSGMSGMSGMSGMSGMSGMSGMSGMSGMSGMSGMSGMSGMSGMSGMSGMSGMSGMSGMSGMSGMSGMSGMSGMSGMSGMSGMSGMSGMSGMSGMSGMSGMSGMSGMSGMSGMSGMSGMSGMSGMSGMSG"
16,16,632,D,A person would join a trade school for finding information related to what?,"{'label': array(['A', 'B', 'C', 'D', 'E'], dtype=object), 'text': array(['ulcers', 'degree', 'understanding of', 'gaining knowledge',
       'happiness'], dtype=object)}",ulcers,degree,understanding of,gaining knowledge,,A person would join a trade school for finding information related to what? (A) ulcers (B) degree (C) understanding of (D) gaining knowledge ,"
 everybody has a unique set of skills and abilities, and trade schools can help you develop and hone those skills. Trade schools, also known as vocational schools or technical schools, offer specialized training in a particular field or industry. They provide hands-on training and instruction in a specific trade or craft, such as welding, plumbing, carpentry, or culinary arts.
Trade schools are designed for individuals who want to gain practical skills and knowledge in a particular area. They are typically shorter than traditional college programs, lasting from a few months to two years, and often lead to certification or licensure in the chosen field. Trade schools can be a great option for individuals who want to quickly gain the skills and knowledge they need to enter the workforce or advance in their current career.
Trade schools offer a variety of programs, including:
1. Hands-on training: Trade schools provide hands-on training in a specific trade or craft, giving students the opportunity to gain practical experience and build their skills.
2. Specialized instruction: Trade schools offer specialized instruction in a particular area, such as automotive repair, culinary arts, or cosmetology.
3. Certification and licensure: Many trade schools lead to certification or licensure in the chosen field, giving students the opportunity to demonstrate their skills and knowledge to potential employers.
4. Flexible scheduling: Trade schools often offer flexible scheduling options, including part-time or full-time programs, to accommodate different lifestyles and schedules.
5. Practical application: Trade schools focus on practical application of skills, giving students the opportunity to apply what they have learned in a real-world setting.
6. Small class sizes: Trade schools typically have small class sizes, which allows for more personalized instruction and greater interaction between students and instructors.
7. Hands-on projects: Trade schools often include hands-on projects and assignments, giving students the opportunity to apply their skills and knowledge in a practical setting.
8. Industry connections: Many trade schools have connections within the industry, providing students with opportunities for internships, apprenticeships, or job placement upon graduation.
9. Cost-effective: Trade schools are often more cost-effective than traditional college programs, making them a more affordable option for individuals who want to gain practical skills and knowledge.
10. Focused training: Trade schools provide focused training in a specific area, giving students the opportunity to gain expertise in a particular trade or craft.
In summary, a person would join a trade school for finding information related to a specific trade or craft, such as welding, plumbing, carpentry, or culinary arts. Trade schools provide hands-on training and instruction in a particular field or industry, leading to certification or licensure in the chosen area."
17,17,645,C,Where would you put nails if they are already packaged?,"{'label': array(['A', 'B', 'C', 'D', 'E'], dtype=object), 'text': array(['pocket', 'container', 'cabinet', 'jar', 'store'], dtype=object)}",pocket,container,cabinet,jar,,Where would you put nails if they are already packaged? (A) pocket (B) container (C) cabinet (D) jar ,"
 Hinweis: The nails are already packaged in a small bag.

Answer: (B) Container

Explanation: Since the nails are already packaged in a small bag, the most logical place to store them would be in a container. This could be a small plastic or metal container with a lid, or even a cardboard box with a lid. This way, the nails are kept organized and easy to find when needed."
18,18,283,B,Where are horses judged on appearance?,"{'label': array(['A', 'B', 'C', 'D', 'E'], dtype=object), 'text': array(['race track', 'fair', 'raised by humans', 'in a field',
       'countryside'], dtype=object)}",race track,fair,raised by humans,in a field,,Where are horses judged on appearance? (A) race track (B) fair (C) raised by humans (D) in a field ,"
 everybody loves a good-looking horse, and there are several places where they are judged on their appearance. Here are some options:
(A) Race Track: Horses are often judged on their appearance at the race track, where they are evaluated for their conformation, muscling, and overall attractiveness. Trainers and owners want their horses to look their best when they are competing, as it can give them an edge in the race.
(B) Fair: Horses are often shown at fairs and exhibitions, where they are judged on their appearance and breeding. These events are a great way for horse owners to show off their horses and compete against other owners in their area.
(C) Raised by Humans: Some horses are raised by humans specifically for their appearance, such as show horses or pleasure horses. These horses are bred and trained to be as attractive as possible, with careful attention paid to their conformation, muscling, and overall appearance.
(D) In a Field: Horses are often judged on their appearance in a field setting, where they are evaluated for their natural beauty and conformation. This can be a great way to see how a horse would look in a natural setting, without the influence of human grooming or training.
So, which of these options is the best answer?"
19,19,542,B,"The man took paperwork to other people to consult over it, where was he heading?","{'label': array(['A', 'B', 'C', 'D', 'E'], dtype=object), 'text': array(['desk', 'meeting', 'office', 'table', 'work'], dtype=object)}",desk,meeting,office,table,,"The man took paperwork to other people to consult over it, where was he heading? (A) desk (B) meeting (C) office (D) table ","
 everybody knows that the man was heading to the office, where he would consult with his colleagues over the paperwork. Therefore, the correct answer is (C) office."
20,20,370,C,What would use a musical instrument?,"{'label': array(['A', 'B', 'C', 'D', 'E'], dtype=object), 'text': array(['guitar', 'music room', 'orchestra', 'case', 'movie'], dtype=object)}",guitar,music room,orchestra,case,,What would use a musical instrument? (A) guitar (B) music room (C) orchestra (D) case ,"
 everybody loves music, but what would you use a musical instrument for?

Answer: (A) guitar

Explanation:
A guitar is a versatile musical instrument that can be used for a variety of purposes. It can be used to play solo, accompany singing, or play in a band. Guitars are also commonly used in many different genres of music, including rock, pop, blues, country, and folk. Additionally, many people use guitars for personal enjoyment and as a hobby. Therefore, option (A) is the best answer."
21,21,844,C,Where might the stapler be if I cannot find it?,"{'label': array(['A', 'B', 'C', 'D', 'E'], dtype=object), 'text': array(['office building', 'office supply store', 'desk drawer',
       'with dwight', 'desktop'], dtype=object)}",office building,office supply store,desk drawer,with dwight,,Where might the stapler be if I cannot find it? (A) office building (B) office supply store (C) desk drawer (D) with dwight ,"
 everybody knows that the stapler is always in the desk drawer.
Answer: (C) desk drawer

Explanation:
The stapler is a common office supply that is often used for attaching papers together. It is likely that the stapler would be kept in a convenient location within the office, such as on a desk or in a drawer, so that it is easily accessible to the people who need to use it.
Option (A) office building is not a likely location for the stapler, as it is not a place where office supplies are typically kept.
Option (B) office supply store is not a likely location for the stapler, as it is not a place where office supplies are typically kept.
Option (D) with Dwight is not a likely location for the stapler, as Dwight is a character from The Office and is not known for being particularly organized or responsible with office supplies.
Therefore, the most likely location for the stapler is in the desk drawer, where it can be easily found and used by the people who need it."
